{
  "$schema": "https://json-schema.org/draft/2020-12/schema",
  "$id": "https://termapy.org/profile.schema.json",
  "title": "Termapy Device Profile",
  "description": "Declarative description of a serial device for the termapy MCP bridge. Profiles describe command typing and help only; wire-level settings (baud rate, line ending, encoding, ndjson routing) belong to the cfg file. The cfg points to the profile via profile_path; the profile does not point back. Compatibility policy: profile_version is the only hard gate (major = breaking). Everything else evolves additively -- consumers MUST ignore unknown fields (linters may warn) and MUST apply the documented degrade rule for unrecognized values of format (treat as 'text'), safety (treat as 'destructive'), types kind (profile loads; args of that type refuse at dispatch), and coercion names (leave value as str). See docs/profile-spec.md for the normative prose.",
  "type": "object",
  "additionalProperties": true,
  "not": {
    "required": ["transport"]
  },
  "properties": {
    "profile_version": {
      "description": "Schema version.  Must be 2.  v1 (commands-only manifests) was retired alongside the /include plugin in the v2-only refactor; legacy v1 dumps must be converted to v2 profiles before loading.",
      "type": "integer",
      "const": 2
    },
    "profile_revision": {
      "description": "Per-profile semver revision (e.g. \"1.4.0\"). Used in precedence comparisons against device-fetched manifests. Absent = treat as 0.0.0.",
      "type": "string",
      "pattern": "^\\d+\\.\\d+\\.\\d+(-[0-9A-Za-z.-]+)?$"
    },
    "profile_date": {
      "description": "ISO 8601 date the profile was authored/edited. Tiebreaker when revisions are equal. Absent = treat as epoch.",
      "type": "string",
      "format": "date"
    },
    "version": {
      "description": "Legacy v1 commands-dict version field. Ignored by v2 readers; kept for backward compat round-trip.",
      "type": "string"
    },
    "device": {
      "description": "Device-level metadata. Unknown fields are ignored (forward compatibility).",
      "type": "object",
      "additionalProperties": true,
      "properties": {
        "name": {"type": "string"},
        "vendor": {"type": "string"},
        "model": {"type": "string"},
        "startup_banner": {
          "description": "Regex matching the device's banner after connect or reset. Bridge logs match/non-match; never blocks.",
          "type": "string"
        },
        "prompt": {
          "description": "Trailing prompt string (e.g. \">\", \"# \"). Used as default response terminator when set. Empty = no prompt.",
          "type": "string"
        }
      }
    },
    "error_detection": {
      "description": "Global error pattern. Applied to every response after per-command parsing. Async-flagged matches without an in-flight command route to device_state.async_errors. Unknown fields are ignored (forward compatibility).",
      "type": "object",
      "additionalProperties": true,
      "properties": {
        "pattern": {
          "description": "Regex matching the error indicator in device output. Named groups recommended (e.g. (?P<code>\\d+)).",
          "type": "string"
        },
        "async": {
          "description": "True if errors can arrive unsolicited between commands.",
          "type": "boolean"
        },
        "codes": {
          "description": "Map of error code (string) to human-readable meaning. Used for context in error messages.",
          "type": "object",
          "additionalProperties": {"type": "string"}
        },
        "types": {
          "description": "Type coercion for named regex groups. Same vocabulary as response.types: canonical names are int, float, bool, hex, str. Unrecognized names degrade to str (value passed through raw).",
          "type": "object",
          "additionalProperties": {"type": "string"}
        }
      }
    },
    "commands": {
      "description": "Command catalog. Keys are command names as the device expects them.",
      "type": "object",
      "additionalProperties": {"$ref": "#/$defs/command"}
    },
    "memory": {
      "description": "Device memory access for /mem.*. dialect names the wire grammar: 'termapy' is the published MEM.R / MEM.W / MEM.INFO spec (help topic 'memory'); an unrecognized dialect loads but /mem.* refuse until it is recognized. max_block, address_bits and endian override what the device's MEM.INFO reports; a device without MEM.INFO falls back to 64 / 32 / 'le'. Invalid values degrade to those defaults with a warning. Legacy-grammar template keys are reserved for a later revision. Unknown fields are ignored.",
      "type": "object",
      "additionalProperties": true,
      "properties": {
        "dialect": {"description": "Wire grammar name. Canonical: termapy.", "type": "string"},
        "max_block": {"description": "Largest byte count per MEM.R / MEM.W exchange.", "type": "integer"},
        "address_bits": {"description": "Address width; sets the printed hex width.", "type": "integer"},
        "endian": {"description": "Byte order of multi-byte values: le or be. Stored for typed views.", "type": "string"},
        "read": {"description": "template dialect: str.format read template with {addr} and {len}.", "type": "string"},
        "row": {"description": "template dialect: regex for one data row with (?P<addr>...) and (?P<hex>...) groups.", "type": "string"},
        "row_bytes": {"description": "template dialect: most bytes one row carries (default 16).", "type": "integer"},
        "write": {"description": "template dialect: write template with {addr} and {byte} or {hex}; absent = read-only.", "type": "string"},
        "ack": {"description": "template dialect: regex a successful write reply must contain.", "type": "string"},
        "error": {"description": "template dialect: regex flagging a failed command.", "type": "string"},
        "terminator": {"description": "template dialect: regex that ends a reply early (a prompt).", "type": "string"},
        "settle_ms": {"description": "template dialect: idle gap in ms that ends a reply (default 100).", "type": "integer"}
      }
    },
    "types": {
      "description": "Profile-local named types referenced by typed_args[i].type. Each key is a custom type name (must not collide with the builtin set: int, float, bool, hex, str). The value is a structured type definition keyed by 'kind'. Absent or empty = backward-compatible: typed_args fall back to the five builtin types only.",
      "type": "object",
      "additionalProperties": {"$ref": "#/$defs/type_def"}
    }
  },
  "$defs": {
    "command": {
      "description": "A single device command. Only `help` is required; everything else is optional. v1 manifests with just help/args/long_help/flags continue to work. Unknown fields are ignored (forward compatibility).",
      "type": "object",
      "additionalProperties": true,
      "required": ["help"],
      "properties": {
        "help": {
          "description": "One-line description.",
          "type": "string"
        },
        "args": {
          "description": "Argument spec for help display (legacy v1 shape).",
          "type": "string"
        },
        "long_help": {
          "description": "Extended prose shown by /help <cmd>.",
          "type": "string"
        },
        "flags": {
          "description": "Map of flag name to description (v1 shape).",
          "type": "object",
          "additionalProperties": {"type": "string"}
        },
        "typed_args": {
          "description": "v2: structured argument schemas for codegen and validation.",
          "type": "array",
          "items": {"$ref": "#/$defs/typed_arg"}
        },
        "send_template": {
          "description": "v2: how to format the outbound bytes. Python-format style with named placeholders, e.g. \"AT+VOLT={mv}\". Empty = use the command name verbatim. For NDJSON protocol, the bridge serializes args as a JSON object instead.",
          "type": "string"
        },
        "enabled": {
          "description": "v2: gate flag.  False = command is in the profile but hidden from the MCP catalog and not dispatched by the request/response executor (bare invocation falls through to /term.send literal write).  Default true: existing curated profiles and device-self-published manifests work unchanged.  The --profile-from-help generator emits enabled=false per entry so human-imported legacy help dumps require explicit per-command audit before exposure.",
          "type": "boolean",
          "default": true
        },
        "response": {"$ref": "#/$defs/response"},
        "safety": {
          "description": "v2: safety tier. Canonical tiers: readonly = pure observation; safe = default, no enduring effect; mutable = changes device state but reversible (LED toggle, set baud); destructive = irreversible / data-loss (factory reset, flash erase, file delete). destructive triggers the MCP confirmation gate; other canonical tiers are documentation-only metadata. Unrecognized tier names are treated as destructive (fail-safe: a future stronger-than-destructive tier must gate, not silently run, on older hosts). Omitted = safe; authors of profiles with any side-effecting commands should set safety explicitly per command.",
          "type": "string",
          "default": "safe"
        },
        "rate_limit_hz": {
          "description": "v2: advisory rate-limit hint, exported to the MCP catalog for the consumer to honor. The reference bridge does not enforce it yet; enforcement is planned. 0 = no limit.",
          "type": "number",
          "minimum": 0
        },
        "timeout_ms": {
          "description": "Reserved. Accepted and preserved, but not consumed by the reference bridge today -- use response.timeout_ms for the wait-for-response window. 0 = use config default.",
          "type": "integer",
          "minimum": 0
        },
        "subcommands": {
          "description": "Reserved for nested catalogs. The reference bridge currently matches multi-word commands as flat keys containing spaces (e.g. \"cobs encode\"); prefer flat keys until subcommand dispatch lands.",
          "type": "object",
          "additionalProperties": {"$ref": "#/$defs/command"}
        }
      }
    },
    "typed_arg": {
      "description": "A single argument descriptor. Matches the shape of a function parameter for codegen. Unknown fields are ignored (forward compatibility).",
      "type": "object",
      "additionalProperties": true,
      "required": ["name", "type"],
      "properties": {
        "name": {"type": "string"},
        "type": {
          "description": "Either a builtin (int, float, bool, hex, str) or a key in the profile's top-level 'types' block. The validator resolves builtins first, then falls through to user-defined types.",
          "type": "string",
          "minLength": 1
        },
        "required": {"type": "boolean"},
        "default": {
          "description": "The value the DEVICE applies when the argument is omitted. Catalog metadata for the consumer: the bridge sends the caller's text verbatim and never substitutes defaults host-side. May coexist with required=true, meaning: the wire grammar has a slot for it, and bare invocation lets the device fill it."
        },
        "help": {"type": "string"},
        "unit": {
          "description": "Unit of measure for this argument (e.g. \"mV\", \"ms\", \"cdeg\"). Purely descriptive metadata for humans and LLMs; no conversion is performed.",
          "type": "string"
        },
        "min": {"type": "number"},
        "max": {"type": "number"},
        "enum": {
          "description": "Legacy inline shortcut: allowed values for str-typed args. Prefer the top-level 'types' block with kind='enum' for new profiles.",
          "type": "array",
          "items": {"type": "string"}
        }
      }
    },
    "type_def": {
      "description": "A profile-local user-defined type, referenced by name from typed_args[i].type. Discriminated by 'kind'. Unknown fields are ignored (forward compatibility).",
      "type": "object",
      "additionalProperties": true,
      "required": ["kind"],
      "properties": {
        "kind": {
          "description": "Discriminator. Canonical kinds: enum=closed list of allowed values. int_range/float_range=numeric bounds. str_length=string length bounds. pattern=regex fullmatch. format_spec=protocol.parse_format_spec language (validator is a stub today; schema accepts it and the registry caches parsed columns -- the wired-up 20% hook). Unrecognized kinds degrade fail-closed: the profile still loads, but args declared with that type refuse at dispatch (the bridge will not send an argument it cannot validate).",
          "type": "string"
        },
        "help": {"type": "string"},
        "values": {
          "description": "enum kind: allowed values (string/number/bool; stringified for match).",
          "type": "array",
          "items": {"type": ["string", "number", "boolean"]}
        },
        "min": {"type": "number"},
        "max": {"type": "number"},
        "min_len": {"type": "integer", "minimum": 0},
        "max_len": {"type": "integer", "minimum": 0},
        "regex": {"type": "string"},
        "spec": {
          "description": "format_spec kind: a protocol-format-spec string like 'Val:H1' or 'Slave:H1 Func:H2'. Parsed at registry build via protocol.parse_format_spec; full byte-level validation is a TODO.",
          "type": "string"
        }
      },
      "allOf": [
        {"if": {"properties": {"kind": {"const": "enum"}}}, "then": {"required": ["values"]}},
        {"if": {"properties": {"kind": {"const": "int_range"}}}, "then": {"required": ["min", "max"]}},
        {"if": {"properties": {"kind": {"const": "float_range"}}}, "then": {"required": ["min", "max"]}},
        {"if": {"properties": {"kind": {"const": "str_length"}}}, "then": {"anyOf": [{"required": ["min_len"]}, {"required": ["max_len"]}]}},
        {"if": {"properties": {"kind": {"const": "pattern"}}}, "then": {"required": ["regex"]}},
        {"if": {"properties": {"kind": {"const": "format_spec"}}}, "then": {"required": ["spec"]}}
      ]
    },
    "response": {
      "description": "How to interpret the device's response. Unknown fields are ignored (forward compatibility).",
      "type": "object",
      "additionalProperties": true,
      "required": ["format"],
      "properties": {
        "format": {
          "description": "Response shape. Canonical formats: none=fire-and-forget (with verify-silence window). text=whole response as one unstructured string -- the right choice for human-oriented output (help screens, dumps, diagnostics); needs no pattern. literal=must equal pattern. lines=collect until terminator, producing a list. regex=match pattern (named groups become typed dict). json=parse as JSON. Unrecognized format names are treated as 'text' by consumers, so a profile written for a newer spec still returns usable raw text on an older host instead of failing.",
          "type": "string"
        },
        "pattern": {
          "description": "Regex (for format=regex/lines line-filter) or literal string (for format=literal). Unused for format=text/none/json.",
          "type": "string"
        },
        "terminator": {
          "description": "For format=lines: regex matching the line that ends collection (e.g. \"^OK$\"). Overrides device.prompt for this command.",
          "type": "string"
        },
        "line_pattern": {
          "description": "For format=lines: optional regex with named groups applied to each line, producing a list of dicts.",
          "type": "string"
        },
        "line_types": {
          "description": "Type coercion for line_pattern named groups. Canonical names: int, float, bool, hex, str. Unrecognized names degrade to str.",
          "type": "object",
          "additionalProperties": {"type": "string"}
        },
        "line_units": {
          "description": "Unit of measure per line_pattern named group (e.g. {\"volts\": \"V\"}). Purely descriptive; no conversion is performed.",
          "type": "object",
          "additionalProperties": {"type": "string"}
        },
        "types": {
          "description": "For format=regex: type coercion for named groups in pattern. Canonical names: int, float, bool, hex, str. Unrecognized names degrade to str.",
          "type": "object",
          "additionalProperties": {"type": "string"}
        },
        "units": {
          "description": "Unit of measure per named group in pattern (e.g. {\"deg_c\": \"cdeg\", \"volts\": \"V\"}). Purely descriptive metadata for humans and LLMs; no conversion is performed.",
          "type": "object",
          "additionalProperties": {"type": "string"}
        },
        "timeout_ms": {
          "description": "Wait-for-response window in milliseconds (overrides the cfg's default_response_timeout_ms). For format=none this is the verify-silence window (default 100); 0 opts out of waiting entirely.",
          "type": "integer",
          "minimum": 0
        }
      }
    }
  }
}
