{
  "profile_version": 2,
  "profile_revision": "1.1.0",
  "profile_date": "2026-05-12",

  "device": {
    "name": "Bassomatic v77 (text simulator)",
    "vendor": "termapy",
    "model": "DEMO"
  },

  "types": {
    "on_off": {"kind": "enum", "values": ["on", "off"], "help": "LED state: on or off."}
  },

  "error_detection": {
    "pattern": "^ERROR(?::\\s*(?P<message>.+))?$",
    "async": false,
    "types": {"message": "str"}
  },

  "memory": {
    "dialect": "termapy",
    "max_block": 64,
    "address_bits": 32,
    "endian": "le"
  },

  "commands": {
    "AT": {
      "help": "Connectivity test (returns OK).",
      "safety": "readonly",
      "response": {"format": "literal", "pattern": "OK", "timeout_ms": 200}
    },
    "AT+PROD-ID": {
      "help": "Product identifier.",
      "safety": "readonly",
      "response": {"format": "regex", "pattern": "(?P<id>.+)", "timeout_ms": 200}
    },
    "AT+INFO": {
      "help": "Multi-line device info dump.",
      "safety": "readonly",
      "response": {
        "format": "lines",
        "terminator": "^OK$",
        "timeout_ms": 500
      }
    },
    "AT+TEMP": {
      "help": "Read current temperature in Celsius.",
      "safety": "readonly",
      "response": {
        "format": "regex",
        "pattern": "(?P<celsius>-?\\d+\\.\\d+)C",
        "types": {"celsius": "float"},
        "timeout_ms": 200
      }
    },
    "AT+RAMP": {
      "help": "Read next sample of a saw-wave generator.",
      "safety": "readonly",
      "response": {
        "format": "regex",
        "pattern": "(?P<value>\\d+)",
        "types": {"value": "int"},
        "timeout_ms": 200
      }
    },
    "AT+STATUS": {
      "help": "Multi-line device status (LED, uptime, baud, ...).",
      "safety": "readonly",
      "response": {
        "format": "lines",
        "terminator": "^OK$",
        "timeout_ms": 500
      }
    },
    "AT+RESET": {
      "help": "Soft reset.  Returns BOOT banner; loses session state.",
      "safety": "destructive",
      "response": {"format": "lines", "terminator": "^OK$", "timeout_ms": 1000}
    },
    "AT+LED": {
      "help": "Set LED state.",
      "send_template": "AT+LED={state}",
      "typed_args": [
        {"name": "state", "type": "on_off", "required": true,
         "help": "LED state."}
      ],
      "safety": "mutable",
      "response": {"format": "literal", "pattern": "OK", "timeout_ms": 200}
    }
  }
}
